{
  "$schema": "http://json-schema.org/draft-07/schema#",
  "title": "civ:Credential:CivicBasic",
  "type": "object",
  "properties": {
    "id": {
      "type": [
        "null",
        "string"
      ]
    },
    "issuer": {
      "type": "string"
    },
    "issued": {
      "type": "string"
    },
    "identifier": {
      "type": "string"
    },
    "expiry": {
      "type": [
        "null",
        "string"
      ]
    },
    "version": {
      "type": "string"
    },
    "type": {
      "type": "array",
      "items": {
        "type": "string"
      }
    },
    "claims": {
      "type": "object",
      "properties": {
        "type": {
          "type": "object",
          "properties": {
            "phone": {
              "type": "object",
              "properties": {
                "countryCode": {
                  "type": "string"
                },
                "number": {
                  "type": "string"
                }
              }
            },
            "email": {
              "type": "object",
              "properties": {
                "domain": {
                  "type": "string"
                },
                "user": {
                  "type": "string"
                }
              }
            }
          }
        }
      }
    },
    "signature": {
      "type": "object",
      "properties": {
        "type": {
          "type": "string"
        },
        "merkleRoot": {
          "type": "string"
        },
        "anchor": {
          "type": "object",
          "properties": {
            "subject": {
              "type": "object",
              "properties": {
                "pub": {
                  "type": "string"
                },
                "label": {
                  "type": "string"
                },
                "data": {
                  "type": "string"
                },
                "signature": {
                  "type": "string"
                }
              }
            },
            "walletId": {
              "type": "string"
            },
            "cosigners": {
              "type": "array",
              "items": {
                "type": "object"
              }
            },
            "authority": {
              "type": "object",
              "properties": {
                "pub": {
                  "type": "string"
                },
                "path": {
                  "type": "string"
                }
              }
            },
            "coin": {
              "type": "string"
            },
            "tx": {
              "type": "string"
            },
            "network": {
              "type": "string"
            },
            "value": {
              "type": "number"
            },
            "type": {
              "type": "string"
            },
            "civicAsPrimary": {
              "type": "boolean"
            },
            "schema": {
              "type": "string"
            }
          }
        },
        "leaves": {
          "type": "array",
          "items": {
            "type": "object"
          }
        }
      }
    }
  },
  "additionalProperties": false
}